"image_link","name","short_desc","long_desc","category","ibu"
"https://farnham-alelager.com/wp-content/uploads/2019/12/12-1.png","12 | Hefeweizen","BLANCHE DE BLÉ ALLEMANDE","Bière non filtrée, naturellement voilée, saveur fruitée avec une finale légèrement acidulée.","Hefeweizen","12"
"https://farnham-alelager.com/wp-content/uploads/2019/12/27-1.png","27 | Pilsener","PILSNER D'INSPIRATION EUROPÉENNE","Goût léger de caramel, amertume non agressante sur finale très houblonnée, rafraîchissante et désaltérante.","Pilsener","27"
"https://farnham-alelager.com/wp-content/uploads/2019/12/35-1.png","35 | Bitter","ALE ANGLAISE","Bière traditionnelle des pubs anglais, maltée sur un corps moyen avec une bonne amertume et arôme de houblon bien présente.","Bitter","35"
"https://farnham-alelager.com/wp-content/uploads/2019/12/42-1.png","42 | Pale Ale Estivale","","Bière au reflet orangé légèrement voilée. Malt présent, mais les houblons sont à l'honneur. Amertume terreuse sur des arômes de houblons très présents qui rappelle les fruits tropicaux. Parfaite pour rafraîchir votre été.","Pale Ale Estivale","42"
"https://farnham-alelager.com/wp-content/uploads/2019/12/58-1.png","58 | New England Ipa","","Bière dorée, non filtrée, amertume des houblons bien présente sur corps léger avec une finale aromatique.","New England Ipa","58"
"https://farnham-alelager.com/wp-content/uploads/2019/12/64-1.png","64 | India Pale Ale","AMÉRICAINE ATYPIQUE","Bière ambrée bien maltée, légère note d'alcool, amertume puissante sur une finale tranchante de houblon.","India Pale Ale","64"
"https://farnham-alelager.com/wp-content/uploads/2019/12/128-1.png","128 | Double India Pale Ale","","Bière d'inspiration américaine utilisant les 3 C classique (cascade, chinook, centennial) avec une amertume prononcée laissant place à des arômes explosives d'agrumes.","Double India Pale Ale","128"
"https://farnham-alelager.com/wp-content/uploads/2019/12/scotch-1.png","Ale écossaise","","Bière d'inspiration écossaise d'un brun rougeâtre, peu effervescente se démarquant par sa rondeur et ses saveurs caramélisées. Mélange bien soutenu par une amertume sur une finale rappelant les bons bourbons.","Ale écossaise","Ale écossaise"
